Q.1 Increase the reorder level of Shirts to 80.
sol: UPDATE STUDENT_PRODUCT_MASTER_50
     SET REORDERLVL = 80;

Q.2 Increase unit selling price of all products by 10%.
SOL: UPDATE STUDENT_PRODUCT_MASTER_50
     SET SELLPRICE = SELLPRICE + SELLPRICE*0.10;
OUTPUT:
SQL> SELECT SELLPRICE "SELLPRICE AFTER CHANGE" FROM STUDENT_PRODUCT_MASTER_50;

SELLPRICE AFTER CHANGE
----------------------
                   385
                   550
                   660
                   825
                   935
                   770
                   385
                   330
                   495
                   385

10 rows selected.

Q.3 Change YtdSales of S00003 by 35.
SOL: UPDATE STUDENT_SALESMAN_MASTER_50
     SET YTDSALES = YTDSALES + 35 WHERE SALESMANNO = 'S00003';
OUTPUT:
SQL> SELECT YTDSALES,SALESMANNO "AFTER CHANGE SALESMANNO" FROM STUDENT_SALESMAN_MASTER_50;

  YTDSALES AFTER
---------- ------
        50 S00001
       100 S00002
       135 S00003
       150 S00004

Q.4 Set  all  QtyDisp  values  equal  to  the  corresponding QTYOrdered  valUes  where ProductRate is less than or equal to 1000.
SOL: UPDATE STUDENT_SALES_ORDER_DETAILS_50
     SET QTYDISP = QTYORDERED WHERE PRODUCTRATE<='1000';
OUTPUT:
SQL> SELECT QTYDISP,QTYORDERED FROM STUDENT_SALES_ORDER_DETAILS_50;

   QTYDISP QTYORDERED
---------- ----------
         4          4
         1          2
         1          2
        10         10
         3          3
         1          3
        10         10
         4          4
         2          2
         1          1
         0          1

   QTYDISP QTYORDERED
---------- ----------
         0          1
        10         10
         3          5

14 rows selected.

Q.5 Change Pincode of clients from Mumbai to 400001. 
SOL: UPDATE STUDENT_CLIENT_MASTER_50
     SET PINCODE = 400001 WHERE CITY LIKE 'Mumbai';
OUTPUT:
SQL> SELECT PINCODE FROM STUDENT_CLIENT_MASTER_50 WHERE CITY LIKE 'Mumbai';

   PINCODE
----------
    400001
    400001
    400001

Q.6 Set all the reorder levels to double the existing values.
SOL: UPDATE STUDENT_PRODUCT_MASTER_50
     SET REORDERLVL = REORDERLVL*2;
OUTPUT:
AFTER CHANGE REORDERLVL
-----------------------
                    160
                    160
                    160
                    160
                    160
                    160
                    160
                    160
                    160
                    160

10 rows selected.

Q.7 Remove records of all cancelled orders.
SOL: DELETE FROM STUDENT_SALES_ORDER_DETAILS_50
     WHERE ORDERNO IN ( SELECT ORDERNO FROM STUDENT_SALES_ORDER_50 WHERE ORDERSTATUS IN 'CANCELLED');
    
     DELETE FROM STUDENT_SALES_ORDER_50 WHERE ORDERSTATUS LIKE 'CANCELLED';

Q.8 Remove all records from Salesman_Master table (populate the table again).
SOL: DELETE FROM STUDENT_SALES_ORDER_50;
     DELETE FROM STUDENT_SALESMAN_MASTER_50;

Q.9 Find all the products whose qty_in_hand is less than reorder level.
SOL: SELECT PRODUCTNO,DESCRIPTION FROM STUDENT_PRODUCT_MASTER_50
     WHERE QTYINHAND < REORDERLVL;
OUTPUT:
PRODUC DESCRIPTION
------ ---------------
P0345  Shirts
P06734 Cotton Jeans
P07865 Jeans
P07868 Trousers
P07885 PuMOvers
P07965 Denim Shirts
P07975 Lyers Tops
P08865 Skirts

8 rows selected.

 
ALTER TABLE STUDENT_SALES_ORDER_50 MODIFY ORDERSTATUS VARCHAR2(11);